{
  "$schema": "https://json-schema.org/draft/2020-12/schema",
  "$id": "https://wizarck.github.io/ai-playbook/schemas/schema-caveman-toggle-v1.json",
  "title": "caveman toggle state (v1)",
  "description": "Per-project caveman feature toggle. Single source of truth at <project>/.ai-playbook/caveman.json. Read/written exclusively through scripts/caveman/toggle.py. UI consumers MUST go through the CLI (python -m scripts.caveman) rather than touching the file directly.",
  "type": "object",
  "additionalProperties": false,
  "required": [
    "schema",
    "enabled",
    "mode",
    "components",
    "applied_at"
  ],
  "properties": {
    "schema": {
      "type": "string",
      "const": "caveman-toggle/v1",
      "description": "Schema versioning hook. MUST be 'caveman-toggle/v1' for this version. Future bumps require a migration script under scripts/caveman/migrations/."
    },
    "enabled": {
      "type": "boolean",
      "description": "Master switch. When false, all components are inert regardless of their individual flags."
    },
    "mode": {
      "type": "string",
      "enum": ["lite", "full", "ultra"],
      "description": "Intensity level for response_style. Only consulted when components.response_style is true."
    },
    "components": {
      "type": "object",
      "additionalProperties": false,
      "required": [
        "response_style",
        "compress_docs",
        "subagents_cavecrew",
        "commit_caveman",
        "review_caveman",
        "mcp_shrink"
      ],
      "properties": {
        "response_style": {
          "type": "boolean",
          "description": "Inject the caveman ruleset block into AGENTS.md (materialise) and enable per-turn reinforcement hook."
        },
        "compress_docs": {
          "type": "boolean",
          "description": "Capability flag — does NOT auto-compress. Gates the /caveman-compress skill and the `caveman compress <file>` CLI subcommand."
        },
        "subagents_cavecrew": {
          "type": "boolean",
          "description": "Allow Claude to delegate to cavecrew-investigator/builder/reviewer subagents when applicable."
        },
        "commit_caveman": {
          "type": "boolean",
          "description": "Enable the caveman-commit skill (terse Conventional Commits)."
        },
        "review_caveman": {
          "type": "boolean",
          "description": "Enable the caveman-review skill (one-line PR review)."
        },
        "mcp_shrink": {
          "type": "boolean",
          "description": "Wrap MCP server commands with caveman-shrink to compress tool descriptions in flight. Requires Node + npx. Backed up before mutation."
        }
      },
      "description": "Per-component flags. Allows the UI to render six independent toggles. response_style/mcp_shrink are persistent state; compress_docs/commit_caveman/review_caveman are capability gates for on-demand skills."
    },
    "applied_at": {
      "type": "string",
      "format": "date-time",
      "description": "ISO 8601 UTC timestamp of the last write. Used by audit/telemetry."
    },
    "applied_by": {
      "type": "string",
      "maxLength": 128,
      "description": "Identifier of the agent/user that last toggled state. Optional. Sourced from $USER / $USERNAME by the CLI; UI consumers should set explicitly."
    }
  }
}
