{
  "applied_at": "2026-05-25T00:22:20.749813+00:00",
  "applied_by": "Arturo",
  "components": {
    "commit_caveman": true,
    "compress_docs": true,
    "mcp_shrink": true,
    "response_style": true,
    "review_caveman": true,
    "subagents_cavecrew": true
  },
  "enabled": true,
  "mode": "full",
  "schema": "caveman-toggle/v1"
}
